{
  "protocol": "CGH/1",
  "protocol_version": "1.0.0",
  "pack_id": "cgh-20260917-four-transparent-workflow-icons",
  "manifest_sha256": "ecde10c0eeb33fa6d485a047f2aaa2d9182cc3465972b0b9bf29669a8a50ca28",
  "status": "partial",
  "completed_turn_ids": [],
  "files": [],
  "findings": [],
  "deviations": [],
  "gaps": [
    "Populate only actually delivered files and completed turns; no output is assumed."
  ],
  "observed_execution": {
    "model_label": null,
    "thinking_label": null,
    "basis": "unknown",
    "tools_used": []
  },
  "extensions": {}
}
