{
  "protocol": "CGH/1",
  "protocol_version": "1.0.0",
  "pack_id": "cgh-20260917-inspect-a-synthetic-workflow-diagram",
  "manifest_sha256": "63008b19afc7279cce0c03547d98552181e850d96430cbf89ae0bcbb12e4dc26",
  "status": "partial",
  "completed_turn_ids": [],
  "files": [],
  "findings": [],
  "deviations": [],
  "gaps": [
    "Populate only actually delivered files and completed turns; no output is assumed."
  ],
  "observed_execution": {
    "model_label": null,
    "thinking_label": null,
    "basis": "unknown",
    "tools_used": []
  },
  "extensions": {}
}
