{
  "protocol": "CGH/1",
  "protocol_version": "1.0.0",
  "pack_id": "cgh-20260917-review-an-empty-input-edge-case",
  "manifest_sha256": "cca088a5beefaa683596f052ddb7b32822600f5b7ddf5ea4b219742100b0dc7d",
  "status": "partial",
  "completed_turn_ids": [],
  "files": [],
  "findings": [],
  "deviations": [],
  "gaps": [
    "Populate only actually delivered files and completed turns; no output is assumed."
  ],
  "observed_execution": {
    "model_label": null,
    "thinking_label": null,
    "basis": "unknown",
    "tools_used": []
  },
  "extensions": {}
}
